SUPPLIER_ID,SUPPLIER_NAME,CONTACT,EMAIL,ADDRESS
1,Gold Stock Pakistan,863-258-8306,ajulyan0@merriam-webster.com,"G88V+M6G, Block E1 Block E Block E 1 Gulberg III, Lahore, Punjab"
2,Shah Alam Market,634-486-5407,abritee1@de.vu,"Circular Rd, near Mochi Gate, Shah Alam Dhal Mohalla Walled City of Lahore, Lahore, Punjab 54000"
3,Rizwan Enterprizes,139-609-4562,kbarbour2@1und1.de,"Piple Wehra, Shah Alam Market, Lahore, 54100"
4,Fazilat Jewellery,225-484-0869,sdayborne3@webs.com,"112 alamgir market, Shah Alam Dhal Mohalla market, Lahore, Punjab 54009"
5,Hafiz Jewellery Collection,508-375-7532,gpeppard4@list-manage.com,"Acha gujjar milk shop, Gulshan Colony Gul Colony, Lahore, Punjab 54000"
6,Shaikh Iqbal and Sons,450-177-9732,balastair5@washingtonpost.com,"Area Samaj Street 10,Bano Bazar, Ichhra Lahore, Punjab 54600"
7,Noorani Jewellery,188-746-1489,sfice6@shutterfly.com,"K-88 New Alamgir Market, Shah Alam Mohalla Bela Nawab Sahib Walled City of Lahore, Lahore, Punjab 54000"
8,TakhleeqFashion.com,420-996-3098,dsteptowe7@wufoo.com,"Wholesale jeweler 112 New Aalamgir Market, Lahore"
